{
  "schemaVersion": 1,
  "logicalVersion": "v1.16.1",
  "dataset": "heroes",
  "generator": "tools/migration/canonical_data.py",
  "sources": [
    {
      "path": "legacy/web-prototype/data/heroes.json",
      "sha256": "6774ec57564c05bf833147eeb92643e6a71af87f38c985c23dca939d45049b9d",
      "normalization": "utf8_lf"
    }
  ],
  "records": [
    {
      "id": "fireheart",
      "name": "Fireheart",
      "role": "legacy_oracle",
      "branches": [
        "rage",
        "power"
      ],
      "stats": {
        "hp": 930,
        "atk": 26,
        "arm": 6,
        "focus": 24,
        "spd": 0.96,
        "crit": 0.08,
        "critD": 1.5,
        "regen": 9,
        "dodge": 0.07
      },
      "legacy": {
        "id": "fireheart",
        "name": "Fireheart",
        "title": "Flame Duelist",
        "icon": "🔥",
        "color": "#fb5607",
        "favoredBranch": "rage",
        "stats": {
          "hp": 930,
          "atk": 26,
          "arm": 6,
          "focus": 24,
          "spd": 0.96,
          "crit": 0.08,
          "critD": 1.5,
          "regen": 9,
          "dodge": 0.07
        },
        "skill": {
          "name": "Flame Duelist Art",
          "cd": 6,
          "energy": 45,
          "pow": 1.05,
          "type": "phys",
          "status": "burn",
          "dur": 3,
          "dot": 14
        },
        "image": "assets/heroes/fireheart.svg",
        "favoredBranches": [
          "rage",
          "power"
        ]
      },
      "provenance": {
        "source": "legacy/web-prototype/data/heroes.json",
        "pointer": "/0",
        "sourceSha256": "6774ec57564c05bf833147eeb92643e6a71af87f38c985c23dca939d45049b9d"
      }
    },
    {
      "id": "frostfang",
      "name": "Frostfang",
      "role": "legacy_oracle",
      "branches": [
        "ice",
        "precision"
      ],
      "stats": {
        "hp": 975,
        "atk": 26,
        "arm": 9,
        "focus": 33,
        "spd": 0.94,
        "crit": 0.11,
        "critD": 1.5,
        "regen": 10,
        "dodge": 0.09000000000000001
      },
      "legacy": {
        "id": "frostfang",
        "name": "Frostfang",
        "title": "Winter Hunter",
        "icon": "❄️",
        "color": "#7bdff2",
        "favoredBranch": "ice",
        "stats": {
          "hp": 975,
          "atk": 26,
          "arm": 9,
          "focus": 33,
          "spd": 0.94,
          "crit": 0.11,
          "critD": 1.5,
          "regen": 10,
          "dodge": 0.09000000000000001
        },
        "skill": {
          "name": "Winter Hunter Art",
          "cd": 6,
          "energy": 45,
          "pow": 1.05,
          "type": "magic",
          "status": "ice",
          "dur": 3,
          "dot": 14
        },
        "image": "assets/heroes/frostfang.svg",
        "favoredBranches": [
          "ice",
          "precision"
        ]
      },
      "provenance": {
        "source": "legacy/web-prototype/data/heroes.json",
        "pointer": "/1",
        "sourceSha256": "6774ec57564c05bf833147eeb92643e6a71af87f38c985c23dca939d45049b9d"
      }
    },
    {
      "id": "bloodthorn",
      "name": "Bloodthorn",
      "role": "legacy_oracle",
      "branches": [
        "wound",
        "assault"
      ],
      "stats": {
        "hp": 1020,
        "atk": 32,
        "arm": 8,
        "focus": 30,
        "spd": 1.0,
        "crit": 0.17,
        "critD": 1.5,
        "regen": 11,
        "dodge": 0.11000000000000001
      },
      "legacy": {
        "id": "bloodthorn",
        "name": "Bloodthorn",
        "title": "Wound Reaver",
        "icon": "🩸",
        "color": "#ef476f",
        "favoredBranch": "wound",
        "stats": {
          "hp": 1020,
          "atk": 32,
          "arm": 8,
          "focus": 30,
          "spd": 1.0,
          "crit": 0.17,
          "critD": 1.5,
          "regen": 11,
          "dodge": 0.11000000000000001
        },
        "skill": {
          "name": "Wound Reaver Art",
          "cd": 6,
          "energy": 45,
          "pow": 1.05,
          "type": "phys",
          "status": "wound",
          "dur": 3,
          "dot": 14
        },
        "image": "assets/heroes/bloodthorn.svg",
        "favoredBranches": [
          "wound",
          "assault"
        ]
      },
      "provenance": {
        "source": "legacy/web-prototype/data/heroes.json",
        "pointer": "/2",
        "sourceSha256": "6774ec57564c05bf833147eeb92643e6a71af87f38c985c23dca939d45049b9d"
      }
    },
    {
      "id": "stormblade",
      "name": "Stormblade",
      "role": "legacy_oracle",
      "branches": [
        "rage",
        "assault"
      ],
      "stats": {
        "hp": 1065,
        "atk": 32,
        "arm": 9,
        "focus": 33,
        "spd": 1.1400000000000001,
        "crit": 0.16999999999999998,
        "critD": 1.5,
        "regen": 12,
        "dodge": 0.13
      },
      "legacy": {
        "id": "stormblade",
        "name": "Stormblade",
        "title": "Rage Striker",
        "icon": "⚡",
        "color": "#ffd166",
        "favoredBranch": "rage",
        "stats": {
          "hp": 1065,
          "atk": 32,
          "arm": 9,
          "focus": 33,
          "spd": 1.1400000000000001,
          "crit": 0.16999999999999998,
          "critD": 1.5,
          "regen": 12,
          "dodge": 0.13
        },
        "skill": {
          "name": "Rage Striker Art",
          "cd": 6,
          "energy": 45,
          "pow": 1.05,
          "type": "phys",
          "status": "burn",
          "dur": 3,
          "dot": 14
        },
        "image": "assets/heroes/stormblade.svg",
        "favoredBranches": [
          "rage",
          "assault"
        ]
      },
      "provenance": {
        "source": "legacy/web-prototype/data/heroes.json",
        "pointer": "/3",
        "sourceSha256": "6774ec57564c05bf833147eeb92643e6a71af87f38c985c23dca939d45049b9d"
      }
    },
    {
      "id": "duskwhisper",
      "name": "Duskwhisper",
      "role": "legacy_oracle",
      "branches": [
        "essence",
        "shield"
      ],
      "stats": {
        "hp": 1110,
        "atk": 24,
        "arm": 6,
        "focus": 50,
        "spd": 1.12,
        "crit": 0.08,
        "critD": 1.5,
        "regen": 11,
        "dodge": 0.15000000000000002
      },
      "legacy": {
        "id": "duskwhisper",
        "name": "Duskwhisper",
        "title": "Essence Seer",
        "icon": "🔮",
        "color": "#9b5cff",
        "favoredBranch": "essence",
        "stats": {
          "hp": 1110,
          "atk": 24,
          "arm": 6,
          "focus": 50,
          "spd": 1.12,
          "crit": 0.08,
          "critD": 1.5,
          "regen": 11,
          "dodge": 0.15000000000000002
        },
        "skill": {
          "name": "Essence Seer Art",
          "cd": 6,
          "energy": 45,
          "pow": 1.05,
          "type": "magic",
          "status": null,
          "dur": 3,
          "dot": 14
        },
        "image": "assets/heroes/duskwhisper.svg",
        "favoredBranches": [
          "essence",
          "shield"
        ]
      },
      "provenance": {
        "source": "legacy/web-prototype/data/heroes.json",
        "pointer": "/4",
        "sourceSha256": "6774ec57564c05bf833147eeb92643e6a71af87f38c985c23dca939d45049b9d"
      }
    },
    {
      "id": "windrider",
      "name": "Windrider",
      "role": "legacy_oracle",
      "branches": [
        "dodge",
        "precision"
      ],
      "stats": {
        "hp": 930,
        "atk": 26,
        "arm": 7,
        "focus": 39,
        "spd": 0.94,
        "crit": 0.11,
        "critD": 1.5,
        "regen": 10,
        "dodge": 0.16
      },
      "legacy": {
        "id": "windrider",
        "name": "Windrider",
        "title": "Dodge Adept",
        "icon": "🌪️",
        "color": "#8ecae6",
        "favoredBranch": "dodge",
        "stats": {
          "hp": 930,
          "atk": 26,
          "arm": 7,
          "focus": 39,
          "spd": 0.94,
          "crit": 0.11,
          "critD": 1.5,
          "regen": 10,
          "dodge": 0.16
        },
        "skill": {
          "name": "Dodge Adept Art",
          "cd": 6,
          "energy": 45,
          "pow": 1.05,
          "type": "phys",
          "status": null,
          "dur": 3,
          "dot": 14
        },
        "image": "assets/heroes/windrider.svg",
        "favoredBranches": [
          "dodge",
          "precision"
        ]
      },
      "provenance": {
        "source": "legacy/web-prototype/data/heroes.json",
        "pointer": "/5",
        "sourceSha256": "6774ec57564c05bf833147eeb92643e6a71af87f38c985c23dca939d45049b9d"
      }
    },
    {
      "id": "darkbane",
      "name": "Darkbane",
      "role": "legacy_oracle",
      "branches": [
        "power",
        "wound"
      ],
      "stats": {
        "hp": 975,
        "atk": 34,
        "arm": 8,
        "focus": 29,
        "spd": 0.94,
        "crit": 0.14,
        "critD": 1.5,
        "regen": 11,
        "dodge": 0.09000000000000001
      },
      "legacy": {
        "id": "darkbane",
        "name": "Darkbane",
        "title": "Power Breaker",
        "icon": "💥",
        "color": "#ff006e",
        "favoredBranch": "power",
        "stats": {
          "hp": 975,
          "atk": 34,
          "arm": 8,
          "focus": 29,
          "spd": 0.94,
          "crit": 0.14,
          "critD": 1.5,
          "regen": 11,
          "dodge": 0.09000000000000001
        },
        "skill": {
          "name": "Power Breaker Art",
          "cd": 6,
          "energy": 45,
          "pow": 1.05,
          "type": "magic",
          "status": null,
          "dur": 3,
          "dot": 14
        },
        "image": "assets/heroes/darkbane.svg",
        "favoredBranches": [
          "power",
          "wound"
        ]
      },
      "provenance": {
        "source": "legacy/web-prototype/data/heroes.json",
        "pointer": "/6",